Date,Event_Name,Description,Event_Type,Strength,Notes,Short_Label
1930-06-17,Smoot-Hawley Tariff Act,Raised tariffs on 20,000+ imports,Policy,High,Smoot-Hawley
1962-01-01,Trade Expansion Act,Enabled Kennedy Round of tariff reductions,Policy,Moderate,,Trade Exp. Act
1981-05-01,Voluntary Export Restraints,Japan auto exports restricted,Agreement,High,,Vol. Export Res.
2018-03-23,Section 232 Steel/Aluminum Tariffs,25% steel and 10% aluminum tariffs,Executive,High,Start of trade war,Section 232
2018-07-06,Section 301 China Tariffs,$34B in tariffs on Chinese goods,Executive,High,China retaliation begins,Section 301
2019-12-13,Phase One Deal Announced,Partial truce reached, rollback planned,Treaty,Low,Phase 1 Deal
